{
  "contract": "ai-core-ui-screen-manifest/v1",
  "version": "1.0.0",
  "screen_id": "example.shell-web",
  "product_profile": "GLOBAL_BASE",
  "feature_ids": [
    "navigation.header",
    "form.chip",
    "navigation.segmented",
    "data.select-card",
    "action.toggle",
    "action.primary",
    "action.secondary",
    "form.text",
    "data.table",
    "system.responsive",
    "system.focus"
  ],
  "contracts": {
    "data_api": [
      "C:canonical-domain-contract-placeholder"
    ],
    "workflow": [
      "D:workflow-contract-placeholder"
    ]
  },
  "exceptions": [],
  "verification": {
    "viewports": [
      360,
      390,
      412,
      1280,
      1440
    ],
    "states": [
      "default",
      "invalid",
      "busy",
      "success",
      "error"
    ],
    "input_modes": [
      "keyboard",
      "touch",
      "pointer",
      "ime-composition"
    ],
    "locales": [
      "ko-KR",
      "en-US",
      "de-DE",
      "ar-SA"
    ]
  }
}
